summary_nr,report_id,event_date,age,sex,event_desc,event_keyword,const_end_use,build_stories,nonbuild_ht,project_cost,project_type,rel_insp_nr,event_type,occ_code,const_op_cause,fat_cause,fall_distance,fall_ht,injury_line_nr,Category
221572688,950621,4/19/2023,19,F,Employee is killed due to fentanyl overdose,"Drug Overdose,Unresponsive",,,,,,346662828,9,867.0,,,,,1,Other
221596216,950411,4/19/2023,31,M,Employee is killed in fall down dry well hole,"Chain,Fall,Fall From Elevation,Well",C,1.0,,,A,346857626,5,869.0,70.0,,100.0,,1,Falls
221555832,355114,4/18/2023,68,M,Employee dies and is found unresponsive,"Diabetes,Natural Causes,Repair,Roof,Unresponsive",A,2.0,,,C,346641921,14,0.0,43.0,,,,1,Falls
221556004,626600,4/18/2023,31,M,Employee is killed when caught in drill press,"Bleeding,Caught In,Drill Press,Face,Hair,Head,Machine Guarding,Operating,Pulled In,Unguarded",,,,,,346642556,2,779.0,,,,,1,Other
221556392,215000,4/18/2023,59,M,Employee is killed in structural garage collapse,"Collapse,Concrete,Structural Collapse",,,,,,346645286,2,813.0,,,,,1,Crushed/Caught Between
221556475,950614,4/18/2023,26,M,Employee is killed when shot by shoplifter,"Gun,Gunfire,Gunshot,Workplace Violence",,,,,,346645476,14,0.0,,,,,1,Violence
221556566,627100,4/18/2023,78,F,Employee is killed in fall from stage and hits head on table,"Abrasion,Arm,Fall,Fall From Elevation,Head,Laceration,Tripped",,,,,,346645880,14,,,,,,1,Falls
221557697,552652,4/18/2023,19,M,Employee is killed when struck by excavator,"Bucket,Excavator,Head,Struck By",,,,,,346654106,2,889.0,,,,,1,Blunt Force/Struck By Objects
221555584,551800,4/17/2023,66,M,Employee is killed in fall down stairs,"Blunt force trauma,Fall,Stair",,,,,,346639628,5,805.0,,,,,1,Falls
221555840,728900,4/17/2023,49,M,"One is killed, one is injured in explosion","Agitator,Bolt,Explosion,Fall,Fall From Elevation,Grinder,Ignite,Repair,Spark,Tank",,,,,,346642077,5,,,,,,1,Falls
221555915,636900,4/17/2023,55,M,Employee is killed when crushed by aerial lift,"Aerial Lift,Blunt force trauma,Caught Between,Crushed,Head,Highway Shoulder,Loading,Pinned,Tips Over,Trailer",,,,,,346642390,1,,,,,,1,Blunt Force/Struck By Objects
221556467,751910,4/17/2023,52,M,Employee is killed when struck by motor vehicle,"Blunt force trauma,Bus,CPR,Head,Motor Vehicle,Struck By,Tow Truck,Traffic Accident",,,,,,346642192,1,849.0,,,,,1,Blunt Force/Struck By Objects
221556749,216000,4/17/2023,67,M,Employee is killed due to head trauma,"Blunt force trauma,Concrete,Fall,Fall On Same Level,Head,Struck Against",,,,,,346646532,14,,,,,,1,Falls
221561145,625700,4/17/2023,53,M,Employee dies of heart attack,"Battery,Electric Shock,Heart Attack",J,,,,C,346676349,12,7010.0,70.0,,,,1,Medical Events
221556715,420300,4/16/2023,54,M,Employee collapses and later dies,"Fall,Fall On Same Level,Fracture,Skull",,,,,,346646870,4,7020.0,,,,,1,Falls
221572902,452110,4/16/2023,42,M,Employee dies from traffic accident,"Motor Vehicle,Struck By,Traffic Accident",,,,,,346776131,1,999.0,,,,,1,Blunt Force/Struck By Objects
221555089,625500,4/15/2023,52,M,"One employee is killed, one is injured when struck by steel","Blunt force trauma,Falling Object,Load Shift,Metal Pipe,Pipe,Struck By",P,,,,A,346636541,1,869.0,52.0,,,,1,Falls
221555212,626300,4/15/2023,54,M,Employee dies of asphyxiation,"Asphyxiated,Caught Between,Front End Loader,Pinned,Sensor",,,,,,346637523,1,,,,,,1,Crushed/Caught Between
221555634,418200,4/15/2023,61,M,Employee is killed when struck by falling branch,"Chest,Crushed,Falling Object,Kidney,Puncture Wound,Rib,Spleen,Struck By,Tree Limb,Tree Section",,,,,,346639792,1,889.0,,,,,1,Falls
221555691,552652,4/15/2023,44,M,Employee dies of natural causes,"Asthma,Natural Causes,Production Line,Robot,Robotics,Smoking,Welding",,,,,,346640337,14,,,,,,1,Medical Events
221556368,213100,4/15/2023,41,F,Employee with COVID-19 infection dies,Infectious Disease,,,,,,346639750,12,95.0,,,,,1,Other
221556632,729300,4/15/2023,32,F,Employee is killed when strikes head against sink,"Blunt force trauma,Fall,Fall On Same Level,Head,Struck Against,Unresponsive",,,,,,346646276,4,439.0,,,,,1,Falls
221557515,1050210,4/15/2023,23,M,Employee is killed when slips and strikes pipe,"Fracture,Pipe,Skull,Slip,Slippery Surface,Struck Against",M,,0.0,,B,346652209,6,0.0,70.0,,0.0,0.0,1,Blunt Force/Struck By Objects
221560741,626000,4/15/2023,62,M,"Employee experiences seizure, later dies due to meningitis","Illness,Infection,Infectious Disease,Loss of consciousness,Medical Condition,Nerve damage,Seizure,Training,Unconsciousness",,,,,,346680408,14,423.0,,,,,1,Medical Events
221562267,751910,4/15/2023,54,M,Employee is killed after falling off ladder,"Concrete,Concussion,Cut,Drum,Fall,Head,Ladder,Slid,Unconsciousness,Welding",,,,,,346693302,5,,,,,,1,Falls
221554900,626700,4/14/2023,28,M,Employee is electrocuted and killed,"Electrocuted,Fall,Fall From Elevation,Ladder,Lighting Fixture,Troubleshooting,Unguarded Live Parts",C,1.0,,,A,346634983,13,,25.0,,,,1,Falls
221554983,524700,4/14/2023,45,M,"Employee is crushed in blanker machine, resulting in fatality","Actuated,Caught In,Clearing,Conveyor,Crushed,Head,Hydraulic,Jammed,Neck,Pinch Point,Pneumatic",,,,,,346635402,2,725.0,,,,,1,Crushed/Caught Between
221555097,214700,4/14/2023,27,M,Employee is killed in fall through roof,"Fall,Fall From Elevation,Fracture,Installing,Metal Decking,Roof,Skull",C,,,,C,346636640,5,595.0,43.0,,18.0,18.0,1,Falls
221555204,317700,4/14/2023,44,M,Employee is killed when struck by falling pipe,"Chest,Crushed,Falling Object,Metal Pipe,Struck By",,,,,,346637440,1,7056.0,,,,,1,Falls
221555337,625700,4/14/2023,40,M,Employee is crushed by skidder tire,"Bolt,Crushed,Skidder,Struck By,Tire",,,,,,346638257,2,,,,,,1,Blunt Force/Struck By Objects
221555592,950647,4/14/2023,72,M,Employee is killed in tractor roll over,"Operating,Roll-Over,Slope,Tractor",,,,,,346639677,14,856.0,,,,,1,Other
221557002,950624,4/14/2023,33,F,Employee dies of natural causes,"CPR,Natural Causes,Unresponsive",,,,,,346648934,12,488.0,,,,,1,Medical Events
221558182,627700,4/14/2023,23,M,Employee is killed when stuck in chest by flying plug,"Chest,Flying Object,Heat Exchanger,High Pressure,Impaled,Lack of Engineering Controls,Puncture,Puncture Wound,Sheet Metal,Struck By",,,,,,346639735,1,,,,,,1,Blunt Force/Struck By Objects
221558455,454510,4/14/2023,24,M,Employee is killed when caught in hopper,"Caught In,Chain,Cleaning,Foot,Hopper,Slip,Slippery Surface",,,,,,346652837,2,999.0,,,,,1,Construction/Material Handling
221560659,454711,4/14/2023,55,M,Employee is killed in fall through skylight,"Aerial Lift,Concrete,Fall,Fall From Elevation,Laborer,Roof,Skylight",C,2.0,,,B,346680358,5,869.0,22.0,,26.0,26.0,1,Falls
221554850,524530,4/13/2023,60,M,Employee is killed when struck by abrasive wheel,"Abrasive Wheel,Auger,Cutting,Face,Fracture,Front End Loader,Grinder,Laceration,Mouth,Sander,Struck By",,,,,,346634819,1,475.0,,,,,1,Blunt Force/Struck By Objects
221555063,418100,4/13/2023,56,M,Employee is killed when dirt compactor overturns,"Brick,Demolition,Operating,Overturn",A,,,,B,346636491,2,7020.0,46.0,,,,1,Other
221555071,134000,4/13/2023,43,M,Employee dies of heart attack,"HVAC,Heart Attack,Installing",,,,,,346636269,14,,,,,,1,Medical Events
221555360,454510,4/13/2023,57,M,Employee is killed due to asphyxiation,"Asphyxiated,Caught Between,Fall Protection,Maintenance,Pinned,Pipe,Press,Unresponsive",,,,,,346638497,2,999.0,,,,,1,Falls
221555709,214500,4/13/2023,72,M,"Employee collapses while moving pallets, resulting in fatality","Bale,Natural Causes,Pallet",,,,,,346640485,14,877.0,,,,,1,Medical Events
221592165,830500,4/13/2023,44,M,Employee is killed in fall from elevation,"Fall,Fall From Elevation,Waterproofing",B,11.0,,,A,346636897,5,7010.0,15.0,,100.0,100.0,1,Falls
221554298,355112,4/12/2023,30,M,"Forklift falls on top of operator, resulting in fatality","Backing Up,Flatbed Truck,Forklift,Pallet,Pinned,Slip",,,,,,346629140,2,889.0,,,,,1,Crushed/Caught Between
221554538,452110,4/12/2023,39,F,Employee is killed when struck by object,Struck By,,,,,,346632128,1,999.0,,,,,1,Blunt Force/Struck By Objects
221554637,316400,4/12/2023,36,M,Employee is killed in fall through roof,"Blunt force trauma,Column,Fall,Fall From Elevation,Fall Protection,Head,Installing,Insulation,Roof,Struck Against",C,,,,A,346633225,6,,43.0,,10.0,27.0,1,Falls
221554868,626600,4/12/2023,65,M,Employee is killed in fall from elevation,"Blunt force trauma,Fall,Fall From Elevation,Head,Installing,Tripped,Walking Backward",C,,,,A,346634835,5,,24.0,,29.0,29.0,1,Falls
221554884,420600,4/12/2023,51,M,Employee is killed in fall from balcony,"Fall,Fall From Elevation,Guardrail,Handrail,Roof",B,3.0,,,B,346634686,5,,,,33.0,33.0,1,Falls
221555139,253410,4/12/2023,62,M,Employee dies of cardiac arrest at home,"Cardiac Arrest,Fire Fighter",,,,,,346636848,12,417.0,,,,,1,Medical Events
221555378,452110,4/12/2023,74,M,Employee is killed when struck by motor vehicle,"Motor Vehicle,Struck By,Traffic Accident",,,,,,346638554,1,999.0,,,,,1,Blunt Force/Struck By Objects
221563083,215000,4/12/2023,56,M,Employee is killed in fall from top of stair rail,"Blunt force trauma,Concrete,Fall,Fall From Elevation,Head,Scaffold",B,,7.0,,C,346637705,5,7010.0,12.0,,3.0,7.0,1,Falls
221553746,420600,4/11/2023,47,M,Employee is killed when struck by stone slab,"Crushed,Forklift,Struck By",,,,,,346624646,6,715.0,,,,,1,Blunt Force/Struck By Objects
221554041,950647,4/11/2023,52,M,Employee is killed due to blunt force injuries,"Blunt force trauma,Operating,Tractor",,,,,,346627128,14,479.0,,,,,1,Blunt Force/Struck By Objects
221554256,524500,4/11/2023,66,M,Employee is killed in locomotive incident,"Blunt force trauma,Broken Bone,Chest,Crushed,Flatbed Rail Car,Heart,Laceration,Locomotive,Operator,Rib",,,,,,346628977,6,823.0,,,,,1,Blunt Force/Struck By Objects
221554785,418400,4/11/2023,59,M,Employee is killed when engulfed by corn,"Corn,Engulfed,Grain Bin,Grain Elevator,Suffocated",,,,,,346634124,14,889.0,,,,,1,Other
221554967,950621,4/11/2023,33,M,Employee is killed due to carbon monoxide poisoning,"Carbon Monoxide,Gas,Residential Construction",A,,,,C,346635345,12,759.0,31.0,,,,2,Construction/Material Handling
221555493,552652,4/11/2023,63,M,Employee dies from blastomycosis when exposed to mold and fungal spores,"Inhalation,Mold",,,,,,346639347,8,0.0,,,,,1,Other
221556384,830600,4/11/2023,53,M,Employee is killed in fall through skylight,"Fall,Fall From Elevation,Roof,Skylight",H,,9.0,,C,346645088,5,7010.0,70.0,,,,1,Falls
221556624,214500,4/11/2023,61,M,Employee is killed when run over by cement truck,"Blunt force trauma,Cement truck,Fall,Fall On Same Level,Hip,Jump On Moving Equip,Leg,Run Over,Slip,Struck By",,,,,,346646367,1,,,,,,1,Falls
221553704,524500,4/10/2023,55,M,Employee sustains fatal burns while removing pipe joint with pliers,"Acetylene Torch,Air Conditioner,Airport,Burn,Fire,Maintenance",,,,,,346624257,14,585.0,,,,,1,Fire/Explosion
221553837,625500,4/10/2023,38,M,Employee is electricuted while operatng truck sand line controls,"Electrocuted,Lost consciousness,Overhead Power Line",,,,,,346625007,13,,,,,,1,Electrocution/Shock
221553993,627700,4/10/2023,48,M,Employee is killed in trench collapse,"Collapse,Sewer,Trench",A,,12.0,,C,346626286,2,7039.0,52.0,,,,1,Crushed/Caught Between
221554090,551800,4/10/2023,65,M,Employee is killed in tree trimming incident,"Blunt force trauma,Chain Saw,Falling Object,Heart Attack,Ladder,Tree Care,Tree Felling,Tree Limb",,,,,,346627094,5,7010.0,,,,,1,Falls
221554132,854910,4/10/2023,49,M,Employee is killed in fall from roof,"Fall,Fall From Elevation,Head,Roof",,,,,,346626153,5,595.0,,,,,1,Falls
221554934,551800,4/10/2023,61,M,Employee is killed when struck by angle iron,"Blunt force trauma,Head,Prison,Struck By,Workplace Violence",,,,,,346635113,1,7031.0,,,,,1,Blunt Force/Struck By Objects
221557176,453710,4/10/2023,47,M,Employee dies of brain bleed,"Brain Bleed,Fracture,Skull",,,,,,346650336,14,999.0,,,,,1,Other
221563364,951510,4/10/2023,74,M,Employee dies of carbon monoxide poisoning,"Brick,Carbon Monoxide,Paint,Pressure Wash,Unconsciousness",H,,0.0,,B,346627797,8,16.0,31.0,,,,1,Other
221577638,950647,4/9/2023,62,M,Employee with COVID-19 infection dies,Infectious Disease,,,,,,346810419,14,174.0,,,,,1,Other
221553449,950633,4/8/2023,68,M,Employee dies of natural causes,"Natural Causes,Unresponsive",,,,,,346622251,14,426.0,,,,,1,Medical Events
221555733,950633,4/8/2023,57,M,Employee dies of heart attack,"Heart Attack,Truck,Truck Driver,Unresponsive",,,,,,346640659,14,7056.0,,,,,1,Vehicle Accidents
221553100,215000,4/7/2023,54,M,Employee falls approximately four stories and dies,"Blunt force trauma,Fall,Fall From Elevation,Ladder,Window,Window Washer",,,,,,346620867,5,453.0,,,,,1,Falls
221553134,522000,4/7/2023,37,M,Employee is killed when struck by vehicle,"Highway Shoulder,Motor Vehicle,Struck By,Traffic Accident",,,,,,346620941,1,,,,,,1,Blunt Force/Struck By Objects
221554009,355114,4/7/2023,65,M,Employee dies of heart attack,Heart Attack,,,,,,346620974,12,,,,,,1,Medical Events
221556186,950621,4/7/2023,65,M,Employee dies of natural causes,"Driving,Natural Causes,Truck Driver",,,,,,346643489,8,,,,,,1,Vehicle Accidents
221557598,1055360,4/7/2023,36,M,Employee is found unresponsive,"Hydraulic Line,Unresponsive,Working Alone",,,,,,346632441,14,999.0,,,,,1,Other
221560832,950635,4/7/2023,45,M,"Employee is injured when struck by DWI driver, later dies","Alcohol,Automobile,Driver,Dwi,Fracture,Laceration,Motor Vehicle,On-Demand Taxicab Service,Road,Struck By",,,,,,346674344,1,809.0,,,,,1,Blunt Force/Struck By Objects
221561483,636900,4/7/2023,19,M,"Employee is killed when run over, crushed by loader tires","Agriculture,Agriculture Machinery/Vehicle,Back,Bucket,Chest,Crushed,Distracted,Farm,Farm Machinery,Farm worker,Fracture,Front End Loader,Insufficient Supervision,Lack of Engineering Controls,Leg,Load",,,,,,346627367,1,479.0,,,,,1,Crushed/Caught Between
221552599,317700,4/6/2023,19,M,Employee is killed when struck by tree limb,"Blunt force trauma,Struck By,Traumatic Brain Injury,Tree Care,Tree Felling,Tree Limb",,,,,,346616147,1,,,,,,1,Blunt Force/Struck By Objects
221552938,522500,4/6/2023,62,M,"Employee falls from bucket, later dies","Bucket,Excavator,Fall,Fall From Elevation,Installing,Tree Limb,Vertebra",B,,,,A,346619257,5,,52.0,,10.0,10.0,1,Falls
221552961,830500,4/6/2023,27,M,Employee is killed when struck by motor vehicle,"Cart,Motor Vehicle,Struck By",,,,,,346619760,1,,,,,,1,Blunt Force/Struck By Objects
221553142,950624,4/6/2023,31,M,Employee is killed when struck by automobile,"Motor Vehicle,Struck By,Traffic Accident",I,,,,C,346619927,1,869.0,42.0,,,,1,Blunt Force/Struck By Objects
221553183,953220,4/6/2023,20,M,Employee is killed while changing tire,"Blowout--Tire,Dump Truck,Jack,Struck By,Tire,Trailer",,,,,,346621048,14,506.0,,,,,1,Blunt Force/Struck By Objects
221555717,854910,4/6/2023,61,M,"Employee is struck by motor vehicle, later dies","Fracture,Motor Vehicle,Skull,Struck By",,,,,,346640535,1,189.0,,,,,1,Blunt Force/Struck By Objects
221556574,215800,4/6/2023,19,M,Employee is killed in fall from height,"Blunt force trauma,Fall,Fall From Elevation",H,2.0,,,A,346615628,5,7004.0,14.0,,30.0,30.0,1,Falls
221552375,551701,4/5/2023,55,M,Firefighter dies during high rise apartment fire,"CPR,Carbon Monoxide,Cardiovasc Disease,Fire,Fire Brigade/Department,Fire Fighter,Respiratory",,,,,,346613730,12,417.0,,,,,1,Fire/Explosion
221552813,419700,4/5/2023,72,M,Employee is killed in fall from communication antenna to ground,"Abrasion,Antenna,Blunt force trauma,Communication Tower,Fall,Fall From Elevation,Fall Protection,Fracture,Laceration,Lanyard,Torso",O,,35.0,,A,346618135,5,7054.0,9.0,,22.0,22.0,1,Falls
221553720,950641,4/5/2023,45,M,Employee is killed when mobile crane overturns,"Blunt force trauma,Mobile Crane,Overturn",,,,,,346624661,14,,,,,,1,Blunt Force/Struck By Objects
221552011,551701,4/4/2023,49,M,Firefighter dies during residential fire,"Burn,Carbon Monoxide,Cardiovasc Disease,Fire,Fire Brigade/Department,Fire Fighter,Unresponsive",,,,,,346611106,8,7022.0,,,,,1,Fire/Explosion
221552029,552652,4/4/2023,61,M,Employee is killed when struck by unsecured falling radiator,"Blunt force,Blunt force trauma,Construction,Crushed,Dismantling,Electrical Work,Electrician,Falling Object,Leg,Material Handling,Removing,Struck By,Transformer,Unsecured",,,,,,346611452,1,575.0,,,,,1,Falls
221552052,830500,4/4/2023,58,M,Employee dies of possible heart attack,"Cart,Fall,Fall On Same Level,Heart Attack,Pushing",,,,,,346611445,12,889.0,,,,,1,Falls
221552151,419700,4/4/2023,28,M,Employee is killed in fall from elevation,"Brain,Fall,Fall From Elevation,Lost Balance,Traumatic Brain Injury",A,2.0,,,A,346612310,5,7010.0,14.0,,7.0,7.0,1,Falls
221552284,453730,4/4/2023,63,M,Employee is killed when struck by wheel loader,"Backing Up,Decapitated,Motor Vehicle,Struck By,Unresponsive,Warehouse,Wheel Loader",,,,,,346612872,1,999.0,,,,,1,Blunt Force/Struck By Objects
221552326,627100,4/4/2023,26,M,Employee is killed when crushed between two trailers,"Abdomen,Chest,Crane,Crushed,Flatbed Truck,Struck By",,,,,,346609589,2,779.0,,,,,1,Blunt Force/Struck By Objects
221552698,317500,4/4/2023,53,M,Employee is killed in golf cart incident,Golf Cart,,,,,,346617046,6,263.0,,,,,1,Other
221552722,418100,4/4/2023,56,M,Employee is killed after falling from scaffold,"Concrete Block,Concrete Floor,Concussion,Fainted,Fall,Fall From Elevation,Head,Scaffold",H,,7.0,,A,346617285,5,563.0,28.0,,1.0,7.0,1,Falls
221555683,936400,4/4/2023,36,M,Employee is found dead in vehicle due to natural causes,"Natural Causes,Patrolman",,,,,,346622061,14,7031.0,,,,,1,Medical Events
221558059,355114,4/4/2023,42,M,Employee is killed when electrocuted,"Amputated,Amputation,Disassemble,Electrical Burn,Electrocuted,Overhead Power Line,Pump Jack Scaffold",B,2.0,,,A,346648165,13,,14.0,,,,2,Electrocution/Shock
221551401,953220,4/3/2023,60,M,Employee is killed when struck by wood frame,"Blunt force trauma,Face,Falling Object,Head,Residential Construction,Struck By,Windy",A,1.0,,,A,346606684,1,869.0,14.0,,,,1,Falls
221551419,420600,4/3/2023,16,M,Employee is killed in fall from roof,"Blunt force trauma,Concrete,Fall,Fall From Elevation,Fall Protection,Roof,Slip",B,3.0,,,C,346606767,5,595.0,43.0,,25.0,32.0,1,Falls
221551799,215600,4/3/2023,41,M,Two employees are killed when crushed by concrete slab,"Blunt force trauma,Concrete Slab,Crushed,Shovel",N,,13.0,,E,346608979,14,7010.0,11.0,,,,1,Blunt Force/Struck By Objects
221551799,215600,4/3/2023,28,M,Two employees are killed when crushed by concrete slab,"Blunt force trauma,Concrete Slab,Crushed,Shovel",N,,13.0,,E,346608979,14,7010.0,11.0,,,,2,Blunt Force/Struck By Objects
221551930,418100,4/3/2023,48,M,Employee is killed when caught between cotton waste bale and forklift attachment mast,"Asphyxiated,Bale,Baler,Caught Between,Forklift",,,,,,346609886,2,,,,,,1,Crushed/Caught Between
221551989,111700,4/3/2023,45,M,Employee is killed in fall from bridge during demolition,"Bridge,Crane,Demolition,Drowning,Fall,Fall From Elevation,Head,Medical Condition,Pallet,Struck Against",J,,18.0,,D,346610942,5,869.0,5.0,,7.0,7.0,1,Falls
221552516,420600,4/3/2023,48,M,Employee is killed when struck by grader,"Crushed,Grader,Rock,Run Over,Struck By",C,1.0,,,A,346609688,1,869.0,46.0,,,,1,Blunt Force/Struck By Objects
221552649,454510,4/3/2023,37,M,Employee is killed when pinned by form,"Caught Between,Chest,Crane,Crushed,Form work,Pinned",,,,,,346616337,2,999.0,,,,,1,Crushed/Caught Between
221555881,155010,4/3/2023,37,F,Employee is killed when attacked by client with axe and knife,"Assault,Blunt force trauma,Cut,Knife,Laceration,Workplace Violence",,,,,,346614431,1,174.0,,,,,1,Blunt Force/Struck By Objects
221551864,552652,4/2/2023,39,M,Employee is killed when struck by motor vehicle,"Head,Motor Vehicle,Struck By,Torso,Traffic Accident",,,,,,346609498,1,7017.0,,,,,1,Blunt Force/Struck By Objects
221553332,215000,4/2/2023,61,M,Employee is found unresponsive at work,Unresponsive,,,,,,346621584,14,448.0,,,,,1,Other
221555824,453720,4/2/2023,48,M,"Employee falls from ladder, later dies","Brain Bleed,Fall,Fall From Elevation,Fracture,Ladder,Skull",,,,,,346641384,5,999.0,,,,,1,Falls
221551427,453710,4/1/2023,66,F,Employee is killed when struck by uprooted tree,"Falling Object,Struck By,Tree",,,,,,346606825,1,999.0,,,,,1,Falls
221551211,111700,3/31/2023,28,M,Employee is killed from head injury in fall from shelving,"Attachment,Attachment Hook,Blunt force,Blunt force trauma,Climbing,Concrete Floor,Fall,Fall From Elevation,Fall Protection,Floor,Forklift,Harness,Head,Lift,Misjudgment,Misjudgment of Hazardous Situati",,,,,,346604853,5,364.0,,,,,1,Falls
221552078,950635,3/31/2023,19,M,Employee commits suicide at worksite,"Fall,Fall From Elevation,Suicide",C,3.0,,,A,346611593,5,7004.0,70.0,,50.0,50.0,1,Falls
221552706,751910,3/31/2023,63,F,Employee is killed in fall from semi trailer,"Cleaning,Fall,Fall From Elevation,Tractor Trailer",,,,,,346616923,5,7056.0,,,,,1,Falls
221552714,625500,3/31/2023,42,M,Employee is killed in fall from ladder,"Cleaning,Concrete,Fall,Fall From Elevation,Ladder,Unstable Position",,,,,,346614563,5,448.0,,,,,1,Falls
221552771,830100,3/31/2023,55,M,Employee is killed in fall off ladder,"Asphalt,Fall,Fall From Elevation,Head,Ladder",,,,,,346617566,5,275.0,,,,,1,Falls
221551070,551800,3/30/2023,57,M,Employee delivering food dies after being shot in chest,"Assault,Bullet,Chest,Delivery Work,Firearm,Flying Object,Food Delivery Service,Gunfire,Gunshot,Projectile,Restaurant,Shot,Workplace Violence",,,,,,346603376,14,277.0,,,,,1,Fire/Explosion
221551104,551800,3/30/2023,85,M,Employee is killed when severely burned in arc flash,"Burn,Chest,Electric Arc,Electric Arc Flash,Electrical Wire,Electrical Work,Electrician,Fuse,Lack of Engineering Controls,Lack of Work Procedures,Removing,Torso",,,,,,346603715,13,575.0,,,,,1,Other
221551344,454711,3/30/2023,52,F,Employee is killed when run over by landfill refuse truck,"Blunt force,Blunt force trauma,Crushed,Distracted,Distracted driving,Driver,Garbage Truck,Landfill,Motor Vehicle,Run Over,Spotter,Struck By,Truck,Truck Driver,Waste Proc Fac",,,,,,346605876,1,558.0,,,,,1,Blunt Force/Struck By Objects
221551658,552652,3/30/2023,34,M,Employee is killed when struck by truck collecting hopper,"Blunt force,Blunt force trauma,Driver,Garbage Truck,Material Handling,Motor Vehicle,Pickup Truck,Pinch Point,Road,Struck By,Traffic Accident",,,,,,346607922,1,875.0,,,,,1,Blunt Force/Struck By Objects
221552367,418300,3/30/2023,58,F,Employee dies from head trauma after being struck by truck,"Asphalt,Blunt force,Blunt force trauma,Break,Department Store,Driver,Head,Motor Vehicle,Parking Lot,Pavement,Struck By,Truck,Unresponsive,Walking Surface",,,,,,346613664,1,,,,,,1,Blunt Force/Struck By Objects
221563612,653510,3/30/2023,59,M,Employee is killed when struck by motor vehicle,"Broken Bone,Highway,Highway work zone,Motor Vehicle,Struck By,Traffic Accident",,,,,,346703291,1,7028.0,,,,,1,Blunt Force/Struck By Objects
221550320,636900,3/29/2023,36,M,Employee is killed from crushing injuries after being pulled into auger,"Asphalt,Auger,Auger Mechanism,Catch Point,Caught In,Cleaning,Conveyor,Crushed,Energized,Entangled,Equipment Operator,Hand Tool,Hopper,Insufficient Supervision,Laceration,Lack of Work Procedures,Lockou",I,,,,E,346598238,2,7020.0,34.0,,,,1,Crushed/Caught Between
221550551,155010,3/29/2023,28,M,Employee is killed after being crushed by falling quartz slabs,"Backing Up,Blunt force,Blunt force trauma,Caught Between,Clamp,Contusion,Crushed,Driver,Falling Object,Forklift,Frame,Industrial Truck,Inexperience,Laborer,Material Handling,Motor Vehicle,PIV,Pinned,P",,,,,,346599368,2,889.0,,,,,1,Falls
221550585,355123,3/29/2023,61,M,Employee is killed when struck by skid steer loader,"Backing Up,Cleaning,Head,Shovel,Skid Steer loader,Slip,Slippery Surface,Struck By",,,,,,346599517,4,,,,,,1,Blunt Force/Struck By Objects
221550627,355123,3/29/2023,48,F,Employee dies from possible heart attack while painting,"Cardiac Arrest,Cardiovasc Disease,Cardiovasc System,Heart,Heart Attack,Medical Condition,Medical History,Natural Causes,Painter,Spray Painting,Underlying Medical Condition",,,,,,346599798,12,759.0,,,,,1,Medical Events
221550650,950633,3/29/2023,56,M,Employee is killed when crushed by Skid Steer loader,"Backing Up,Construction,Crushed,Installing,Skid Steer loader,Struck By,Transformer,Warehouse",,,,,,346600372,1,,,,,,1,Blunt Force/Struck By Objects
221550833,625700,3/29/2023,67,M,Employee dies when crushed while working under falling PIV,"Caught Between,Chest,Crushed,Falling Object,Forklift,Head,Industrial Truck,Material Handling,Mechanic,Misjudgment,Misjudgment of Hazardous Situation,Neck,PIV,Powered Industrial Vehicle,Repair,Unstable",,,,,,346602311,2,,,,,,1,Falls
221550866,523400,3/29/2023,42,M,Employee dies after being electrocuted while installing LED fixture,"Automobile,Automotive Repair,Electric Shock,Electric current,Electrical Wire,Electrical Work,Electrocuted,Energized,Face,Finger,Hand,Installing,Lack of Engineering Controls,Lighting,Lighting Fixture,L",C,,24.0,,B,346598824,13,549.0,25.0,,,,1,Electrocution/Shock
221551831,551800,3/29/2023,17,M,Employee is killed after falling head first into stump grind,"Catch Point,Concussion,Fall,Fall On Same Level,Grinder,Head,Insufficient Supervision,Laborer,Laceration,Lost Balance,Lost Control,Machine Guarding,Machine operator,Pulling,Removal,Struck Against,Stump",,,,,,346609167,6,889.0,,,,,1,Falls
221551849,523300,3/29/2023,54,M,Employee is killed when struck in head by machine part,"Air Pressure,Blunt force,Blunt force trauma,Compressed Air,Energized,Equipment Operator,Flying Object,Head,Lack of Engineering Controls,Lockout,Lockout/Tagout,Logger,Logging,Machine operator,Material",,,,,,346609290,1,496.0,,,,,1,Blunt Force/Struck By Objects
