summary_nr,report_id,event_date,age,sex,event_desc,event_keyword,const_end_use,build_stories,nonbuild_ht,project_cost,project_type,rel_insp_nr,event_type,occ_code,const_op_cause,fat_cause,fall_distance,fall_ht,injury_line_nr,Category
221579394,316700,7/11/2023,57,M,"One employee is killed, another is injured by motorist","Blunt force trauma,Highway work zone,Motor Vehicle,Road,Struck By",J,,,,C,346822521,1,599.0,51.0,,,,1,Blunt Force/Struck By Objects
221579428,213900,7/11/2023,58,M,Employee is killed in fall from height,"Electric Shock,Fall,Fall From Elevation,Installing",C,,,,B,346822703,5,575.0,25.0,,18.0,18.0,1,Falls
221579527,316400,7/11/2023,43,M,Employee is killed via electrocution,"Circuit Breaker,Electric Shock,Electrocuted,Lighting Circuit,Lighting Fixture,Lockout/Tagout,Scissor lift",H,,,,C,346823685,13,,25.0,,,,1,Electrocution/Shock
221579691,418400,7/11/2023,50,M,Employee dies by electrocution while servicing irrigation system,"Arm,Contact,Electric Shock,Electrical Wire,Electrocuted,Irrigation Equipment,Maintenance,Servicing",,,,,,346824550,13,,,,,,1,Electrocution/Shock
221579766,751910,7/11/2023,56,M,Employee dies after being electrocuted by transformer wiring,"Capacitor,Contact,Electric Shock,Electrical Wire,Electrical Work,Electrocuted,Glove,Hand,Lack of Engineering Controls,Lack of Work Procedures,Misjudgment,Misjudgment of Hazardous Situation,PPE,PPE Haz",,,,,,346825672,13,213.0,,,,,1,Electrocution/Shock
221580111,626700,7/11/2023,64,M,Employee is killed in fall while trimming tree from branch,"Abrasion,Blunt force,Blunt force trauma,Concrete Slab,Contusion,Defect,Defective,Defective Equipment,Fall,Fall From Elevation,Fall Protection,Head,Insufficient Supervision,Ladder,Misjudgment,Misjudgme",,,,,,346827926,5,786.0,,,,,1,Falls
221580152,636900,7/11/2023,60,M,Employee is killed when run over by truck,"Cleaning,Crushed,Roll-Over,Rolling,Run Over,Truck",,,,,,346827710,2,869.0,,,,,1,Crushed/Caught Between
221603111,352410,7/11/2023,66,M,Employee is killed when struck by motor vehicle,"Highway work zone,Installing,Internal Injuries,Motor Vehicle,Optical Fiber Cable,Pickup Truck,Struck By,Traffic Accident,Traffic Control,Trailer,Work zone",O,,,,E,346823842,1,,70.0,,,,1,Blunt Force/Struck By Objects
221579071,111100,7/10/2023,34,M,Employee is killed from crushing injuries when run over by truck,"Chest,Cleaning,Crushed,Driver,Lack of Engineering Controls,Motor Vehicle,Neck,Pickup Truck,Run Over,Slip,Slippery Surface,Struck By,Tire,Vacuuming,Wheel,Work Surface",,,,,,346820129,1,887.0,,,,,1,Blunt Force/Struck By Objects
221579204,454714,7/10/2023,50,M,Employee in unprotected trench is killed when wall collapses,"Collapse,Crushed,Trench,Trench Digger,Unprotected",C,,,,B,346820558,14,869.0,52.0,,,,1,Crushed/Caught Between
221579329,419730,7/10/2023,35,M,Employee dies from suspected overdose from unknown substance,"Alcohol,Drug Overdose,Laborer,Natural Causes",,,,,,346821325,14,889.0,,,,,1,Medical Events
221579436,551800,7/10/2023,61,M,Employee dies when strangled while transferring inmate,"Asphyxiated,Correction officer,Inattention,Insufficient Supervision,Neck,Restraining Device,Strangulated,Transportation",,,,,,346822554,14,7030.0,,,,,1,Asphyxiation
221579469,552652,7/10/2023,75,M,Employee is killed after rolling over lawn mower on sloped lawn,"Agriculture,Agriculture Machinery/Vehicle,Caught Between,Crushed,Cutting,Driving,Farm,Farm Machinery,Farm worker,Landscaping,Lawn Mower,Motor Vehicle,Riding on Equipment,Roll-Over",,,,,,346822927,2,479.0,,,,,1,Crushed/Caught Between
221579485,552652,7/10/2023,40,M,Employee on side of road is killed when struck by vehicle,"Blunt force,Blunt force trauma,Delivery Work,Inspecting,Motor Vehicle,Road,Struck By,Traffic Accident,Truck Driver",,,,,,346823164,1,7056.0,,,,,1,Blunt Force/Struck By Objects
221580632,627100,7/10/2023,52,F,"One employee is killed, another is injured when shot by tenant","Arm,Assault,Bullet,Chest,Fire,Firearm,Flying Object,Gunshot,Head,Inspection,Manager,Projectile,Shoulder,Struck By,Workplace Violence",,,,,,346832199,14,16.0,,,,,1,Blunt Force/Struck By Objects
221581150,1055350,7/10/2023,46,M,Employee dies of underlying medical condition,"Fall,Fall From Elevation,Farm,Farm worker,Ladder,Natural Causes,Picking,Underlying Medical Condition",,,,,,346829161,14,999.0,,,,,1,Falls
221581937,418100,7/10/2023,35,M,Employee is killed due to injuries sustained in fall from ladder,"Brain,Collapse,Concrete Floor,Fall,Fall From Elevation,Falling Object,Head,Ladder,Pallet,Struck Against,Traumatic Brain Injury",,,,,,346841281,5,,,,,,1,Falls
221582778,111100,7/10/2023,0,,Employee is killed when crushed by motor vehicle,"CRUSHED,MOTOR VEHICLE,PINNED,RAIN,RUN OVER,SLIP,SLIPPERY SURFACE,STRUCK BY,TRAFFIC ACCIDENT,VACUUMING",,,,,,346849383,1,887.0,,,,,1,Other
221585474,751910,7/10/2023,17,M,Employee is killed in UTV roll over,"Blunt force trauma,Head,Motor Vehicle,Pinned,Roll-Over,Tips Over",,,,,,346871494,2,486.0,,,,,1,Blunt Force/Struck By Objects
221624968,950635,7/10/2023,58,M,Employee suffers medical emergency and dies in warehouse,"Cardiac Arrest,Cardiovasc Disease,Cardiovasc System,Heart,Heart Attack,Hypertension,Material Handling,Unresponsive,Warehouse",,,,,,347169658,14,883.0,,,,,1,Medical Events
221579873,728500,7/8/2023,35,M,Employee dies when electrocuted replacing electrical cables,"Cable,Communication Cable,Contact,Electric Shock,Electric current,Electrical,Electrical Wire,Electrical Work,Electrocuted,Falling Object,Installing,Repair,Shock,Telecom Work,Work Surface",,,,,,346826142,12,7055.0,,,,,1,Falls
221579980,626700,7/8/2023,32,F,"Employee dies of natural causes, found unresponsive in bus","Bus Driver,Driver,Heat index,Heat-related illness,High Temperature,Loss of consciousness,Natural Causes,Transportation,Unresponsive",,,,,,346827009,14,,,,,,1,Medical Events
221597180,418200,7/8/2023,28,M,Employee dies from drug overdose,"Concrete,Demolition,Drug Overdose,Unresponsive",I,,0.0,,B,346817299,14,869.0,4.0,,,,1,Other
221578479,522500,7/7/2023,47,M,Employee dies of natural causes,"Kiln,Natural Causes,Pallet,Underlying Medical Condition,Unresponsive",,,,,,346816200,12,766.0,,,,,1,Medical Events
221578578,551800,7/7/2023,52,F,Employee is killed when struck by dump truck,"Dump Truck,Struck By,Traffic Accident,Traffic Control",I,,,,B,346816341,1,,51.0,,,,1,Blunt Force/Struck By Objects
221578610,950635,7/7/2023,42,M,Employee dies after falling through skylight,"Concrete Floor,Fall,Fall From Elevation,Guardrail,Roof,Roof Opening Cover,Skylight,Tripped,Unguarded Fl Opening",C,3.0,,,B,346816119,5,595.0,43.0,,24.0,24.0,1,Falls
221578958,551800,7/7/2023,52,F,Employee is killed when run over by dump truck on roadway,"Construction,Construction vehicle,Dump Truck,Flagger,Highway,Highway work zone,Laborer,Motor Vehicle,Pavement,Road,Run Over,Struck By,Truck,Work zone",I,,,,E,346819451,1,7010.0,34.0,,,,1,Blunt Force/Struck By Objects
221578966,551800,7/7/2023,52,F,Employee is killed when struck by truck,"Blunt force trauma,Struck By,Traffic Accident,Traffic Control,Truck",,,,,C,346819485,1,,,,,,1,Blunt Force/Struck By Objects
221579501,950633,7/7/2023,47,M,Employee dies of drug overdose,"Carpenter,Drug Overdose,Installing",B,1.0,,,A,346823545,14,599.0,18.0,,,,1,Construction/Material Handling
221596018,454713,7/7/2023,20,M,Employee is killed in riding lawn mower rollover,"Crushed,Crushing,Ditch,Lawn Mower,Riding on Equipment,Roll-Over,Slid,Slope",,,,,,346861685,1,889.0,,,,,1,Crushed/Caught Between
221578164,454712,7/6/2023,45,M,Employee is killed when head is crushed in amusement park ride,"Amusement Park/Carnival,Amusement Ride,Bearing,Caught Between,Crushed,Grease,Head,Moving,Outrigger,Pinned,Structure Moving,Trailer",,,,,,346814346,2,459.0,,,,,1,Crushed/Caught Between
221578198,215600,7/6/2023,31,M,Employee is killed when struck by circular gas-powered saw blade,"Blade,Circular Saw,Demolition,Laceration,Neck,Saw,Struck By",A,,5.0,,D,346813249,1,869.0,5.0,,,,1,Blunt Force/Struck By Objects
221578321,112000,7/6/2023,37,M,Employee is killed in fall from tree,"Fall,Fall From Elevation,Fall Protection,Tree,Tree Care,Tree Climbing System,Tree Limb,Tree Pruner",,,,,,346815228,5,,,,,,1,Falls
221578404,352440,7/6/2023,69,M,Employee is killed when pinned in garbage truck,"Caught Between,Crushed,Garbage Truck,Internal Bleeding,Pinned",,,,,,346815608,2,507.0,,,,,1,Crushed/Caught Between
221578750,625500,7/6/2023,67,M,Employee dies due to natural causes,"Cardiovasc Disease,Loss of consciousness,Natural Causes,Pipe,Residential Construction",A,,,,B,346816598,14,7010.0,5.0,,,,1,Medical Events
221579352,213900,7/6/2023,42,M,Employee dies in car from heat related illness,"Dehydration,Driver,Forklift,Heat Exhaustion,Heat index,Heat-related illness,High Temperature,Lack of Work Procedures,Material Handling,Weather",,,,,,346821531,14,883.0,,,,,1,Vehicle Accidents
221579378,418800,7/6/2023,30,M,Employee dies from medical condition aggravated by narcotics,"Agriculture,Dehydration,Drug Overdose,Farm,Farm worker,Harvesting,Heat index,Heat-related illness,High Temperature,Illness,Loss of consciousness,Medical Condition,Medical History,Unconsciousness,Unde",,,,,,346821838,14,,,,,,1,Medical Events
221582273,953220,7/6/2023,55,M,Employee is killed in fall from height,"Aerial Lift,Blunt force trauma,Bucket,Concrete Floor,Descending,Fall,Fall From Elevation,Head,Warehouse",,,,,,346835259,5,575.0,,,,,1,Falls
221587124,552700,7/6/2023,51,M,Employee is killed in fall from elevation,"Extension Ladder,Fall,Fall From Elevation,Head,Residential Construction,Roof",,,,,,346879588,5,999.0,,,,,1,Falls
221589971,253650,7/6/2023,36,M,One employee is killed and another incurs rib fractures in vehicular crash,"Automobile,Blunt force,Blunt force trauma,Collision,Driver,Driving,Intoxicated,Truck",,,,,,346834534,14,869.0,,,,,1,Blunt Force/Struck By Objects
221577828,523400,7/5/2023,58,M,Employee dies of natural causes,"Head,Laceration,Natural Causes,Underlying Medical Condition",,,,,,346811599,1,519.0,,,,,1,Medical Events
221577869,111100,7/5/2023,35,M,Employee is killed after fall while performing tree trimming,"Broken Bone,Fall,Fall From Elevation,Lanyard,Spine,Tree Care,Tree Climber,Tree Climbing System,Tree Pruner,Tree Trimming",,,,,,346812001,5,,,,,,1,Falls
221577893,636900,7/5/2023,20,M,"One employee is killed, another incurs multiple fractures in forklift fall","Ejected,Fall,Fall From Elevation,Falling Object,Forklift,Fracture,Tip",H,,16.0,,C,346812183,5,869.0,43.0,,16.0,16.0,1,Falls
221578073,317000,7/5/2023,41,M,Employee dies of cardiac arrest,"CPR,Cardiac Arrest,Heart Attack,Heat,Heat Exhaustion,Heat Injury Prevention Program,Heat-related illness,Landscaper,Landscaping,Unresponsive",,,,,,346813439,12,,,,,,1,Medical Events
221578081,627500,7/5/2023,57,M,Employee is killed when hit by tractor trailer,"Brake,Connecting,Crushed,Driver,Slope,Struck By,Torso,Tractor,Tractor Trailer,Trailer",,,,,,346813306,2,804.0,,,,,1,Blunt Force/Struck By Objects
221578123,636900,7/5/2023,0,,"One employee is killed, another fractures pelvis and leg in trash box incident","BROKEN BONE,FALL,FALL FROM ELEVATION,HEAD,LEG,PELVIS,TRASH BIN",C,1.0,,,C,346814171,5,595.0,43.0,,20.0,30.0,1,Other
221578214,522300,7/5/2023,40,M,Employee is killed when entangled in stump grinder,"Bleeding,Broken Bone,Entangled,Fracture,Grinding Machine,Laceration,Landscaper,Landscaping,Tree Stumping",,,,,,346814676,1,889.0,,,,,1,Construction/Material Handling
221578248,728500,7/5/2023,19,M,Employee dies for unknown reason,"Auger,CPR,Digger/Derrick,Utility Pole",O,,8.0,,C,346814619,12,,16.0,,,,1,Other
221578602,625400,7/5/2023,72,M,Employee is killed when crushed by bus,"Activated,Brake,Crushed,Pinned,Troubleshooting,Valve",,,,,,346816440,1,505.0,,,,,1,Crushed/Caught Between
221581663,253420,7/5/2023,45,M,"Two employees die, two employees are injured while fire fighting","Cardiac Arrest,Cardiovasc System,Communication,Face,Fire,Fire Brigade/Department,Fire Fighter,Foot,Head,Heat Exhaustion,High Temperature,Lung,Respiratory,Respiratory Tract,Scba,Ship,Shipyard,Smoke,Smo",,,,,,346823826,12,7022.0,,,,,3,Medical Events
221581663,253420,7/5/2023,49,M,"Two employees die, two employees are injured while fire fighting","Cardiac Arrest,Cardiovasc System,Communication,Face,Fire,Fire Brigade/Department,Fire Fighter,Foot,Head,Heat Exhaustion,High Temperature,Lung,Respiratory,Respiratory Tract,Scba,Ship,Shipyard,Smoke,Smo",,,,,,346823826,2,7022.0,,,,,4,Medical Events
221583768,950635,7/5/2023,62,M,Employee dies after struck in face by metal clip,"Concrete Floor,Cut,Face,Fall,Fall On Same Level,Flying Object,Head,Metal,Pulled In,Rope,Struck By,Tree Trimming,Wood,Wood Chips",,,,,,346856248,1,486.0,,,,,1,Falls
221587173,152500,7/5/2023,70,M,Employee dies due to pre-existing medical condition,"Cardiovasc Disease,Cardiovasc System,Fall,Fall On Same Level,Natural Causes,Underlying Medical Condition",,,,,,346813488,12,,,,,,1,Falls
221588098,253410,7/5/2023,49,M,"Two employees are killed, three are injured due to fire","Burn,Combustible Dust,Fire,Fire Brigade/Department,Fire Fighter,Foot,Heat,Hot Water,Motor Vehicle,Respiratory,Respiratory Tract,Trapped,structure fire",,,,,,346891427,12,417.0,,,,,2,Vehicle Accidents
221588098,253410,7/5/2023,45,M,"Two employees are killed, three are injured due to fire","Burn,Combustible Dust,Fire,Fire Brigade/Department,Fire Fighter,Foot,Heat,Hot Water,Motor Vehicle,Respiratory,Respiratory Tract,Trapped,structure fire",,,,,,346891427,12,417.0,,,,,4,Vehicle Accidents
221608870,355122,7/5/2023,35,M,Employee dies during outdoor physical fitness training activity,"Cardiac Arrest,Cardiovasc Disease,Cardiovasc System,Exercise,Fire Brigade/Department,Fire Fighter,Heart,Heart Attack,High Blood Pressure,Medical Condition,Medical History,Underlying Medical Condition",,,,,,346818701,12,7022.0,,,,,1,Medical Events
221577810,420600,7/4/2023,36,F,Employee is killed when pinned under water by overturned law,"Crushed,Drown,Drowning,Landscaper,Landscaping,Pinned,Roll-Over,Run Over,Water",,,,,,346811565,14,,,,,,1,Crushed/Caught Between
221577844,316700,7/4/2023,68,M,Employee is killed when riding mower flips over,"Asphyxiated,Fall,Fall From Elevation,Falling Object,Hill,Lawn Mower,Lost Control,Pinned,Roll-Over,Seat Belt,Struck Against,Tree,Water",,,,,,346811706,14,486.0,,,,,1,Falls
221577950,418300,7/4/2023,40,M,Employee is killed by electrocution,"Box truck,Electric Shock,Electrocuted,Energized,Installing,Welder,Welding",,,,,,346812456,13,783.0,,,,,1,Electrocution/Shock
221578891,626000,7/4/2023,35,M,Employee is killed when engulfed by grain,"Collapse,Crushed,Engulfed,Grain,Grain Bin,Struck By,Tractor Trailer",,,,,,346818776,1,889.0,,,,,1,Blunt Force/Struck By Objects
221577554,522500,7/3/2023,34,M,Employee is killed after fall down manhole,"Blunt force trauma,Fall,Fall From Elevation,Fixed Ladder,Hand Tool,Head,Hydrogen Sulfide,Ladder,Lost consciousness,Manhole",I,,30.0,,C,346810047,5,7010.0,26.0,,,,1,Falls
221577687,551800,7/3/2023,47,F,Employee is killed after gunshots fired,"Abdomen,CPR,Chest,Gun,Gunfire,Gunshot,Neck,Police",,,,,,346810674,14,7030.0,,,,,1,Other
221578339,950621,7/3/2023,34,M,Employee is killed via electrocution,"Electrical Burn,Electrocuted,Unresponsive,Water,Welding",,,,,,346815335,13,477.0,,,,,1,Electrocution/Shock
221579741,950615,7/3/2023,54,M,"Employee working near road is struck by vehicle, later dies","Blunt force,Blunt force trauma,Concussion,Fracture,Highway,Highway work zone,Irrigation Equipment,Laborer,Maintenance,Motor Vehicle,Reflective Vest,Repair,Road,Sprinkler,Struck By,Traffic Control",,,,,,346825086,1,889.0,,,,,1,Blunt Force/Struck By Objects
221610777,950411,7/3/2023,35,M,Employee dies via electrocution,"Crane,Crane Operator,Electric Shock,Electrocuted,HVAC,High Voltage,Overhead Power Line",C,,,,B,346817133,13,534.0,24.0,,,,1,Electrocution/Shock
221587116,454510,7/2/2023,28,M,Employee is killed in fall from elevation,"Concrete Floor,Fall,Fall From Elevation,Forklift,Forks",,,,,,346857253,5,999.0,,,,,1,Falls
221576796,521100,7/1/2023,16,M,Employee dies when caught in stick conveyor,"Abdomen,Caught Between,Caught In,Chest,Conveyor,Crushed,Forklift,Lumber Stack,Pinned,Tilt-Frame Hoist,Working Alone",,,,,,346804313,2,,,,,,1,Crushed/Caught Between
221577356,418200,7/1/2023,57,F,Employee dies of heart failure,"Heart,Heart Attack,Lost consciousness,Natural Causes,Preexisting Condition,Truck,Unloading",,,,,,346808389,12,274.0,,,,,1,Vehicle Accidents
221577372,950624,7/1/2023,46,M,Employee dies due to heart disease and excessive use of cocaine,"Cardiovasc Disease,Drug Overdose,Heart",,,,,,346808512,14,889.0,,,,,1,Other
221620164,215000,7/1/2023,30,M,Employee is killed in fall from extension ladder,"Blunt force trauma,Concrete Surface,Extension Ladder,Fall,Fall From Elevation,Ladder,Painter",H,2.0,,,C,347133688,5,889.0,15.0,,20.0,,1,Falls
221577281,627100,6/30/2023,42,M,Employee dies from hyperthermia in hot humid conditions,"Bolting,Emergency Response,Heat,Heat Injury Prevention Program,Heat-related illness,Humidity,Hyperthermia,Steel",C,2.0,,,A,346808090,14,7051.0,55.0,,,,1,Other
221577398,1032100,6/30/2023,0,,Employee is killed when struck by rod,"HEAD,STRUCK BY,WELL",,,,,,346808553,1,779.0,,,,,1,Other
221577448,452110,6/30/2023,60,M,Two employees die when struck by oven doors,"Brain Bleed,Door,Explosion,Head,Natural Gas,Oven,Repair,Struck By",,,,,,346807431,1,999.0,,,,,1,Blunt Force/Struck By Objects
221577448,452110,6/30/2023,55,M,Two employees die when struck by oven doors,"Brain Bleed,Door,Explosion,Head,Natural Gas,Oven,Repair,Struck By",,,,,,346807431,1,999.0,,,,,2,Blunt Force/Struck By Objects
221577497,521700,6/30/2023,53,M,Employee is killed when electrocuted,"Cable,Electrocuted,Installing,Scaffold",,,,,,346809866,13,213.0,,,,,1,Electrocution/Shock
221579196,316700,6/30/2023,65,M,Employee is killed in fall to lower level,"Blunt force trauma,Extension Ladder,Fall,Fall From Elevation,Head,Ladder,Maintenance,Repair,Roof,Trailer",,,,,,346818784,5,519.0,,,,,1,Falls
221580277,950644,6/30/2023,22,M,Employee dies of unknown causes pending coroner report,"Automobile,Cleaning,Fatigue,Maintenance,Motor Vehicle,Stomach",,,,,,346828627,14,0.0,,,,,1,Vehicle Accidents
221580301,453710,6/30/2023,58,F,Employee is killed in fall from elevation,"Blunt force trauma,Chest,Fall,Fall From Elevation,Fire Extinguisher,Head,Inspecting,Lift",,,,,,346808868,6,999.0,,,,,1,Falls
221600851,1055320,6/30/2023,46,M,Employee is killed in fall off bridge,"Bridge,Drowning,Fall,Fall From Elevation",,,,,,346888209,5,999.0,,,,,1,Falls
221576994,419400,6/29/2023,52,M,Employee is killed via drowning,"Drown,Drowning,Landscaping,River",,,,,,346805724,14,,,,,,1,Other
221577158,420600,6/29/2023,47,M,Employee is killed when crushed between pump trailer and concrete truck,"Caught Between,Concrete Truck,Crushed,Trailer",H,,,,A,346806896,2,,42.0,,,,1,Crushed/Caught Between
221577307,626600,6/29/2023,35,M,Employee is killed when forklift overturns,"Crushed,Forklift,Head,Lost Control,Overturn,Ramp",,,,,,346808066,1,,,,,,1,Crushed/Caught Between
221579121,953210,6/29/2023,0,,Employee dies after being struck by sheet metal,"BROKEN BONE,FALLING OBJECT,LEG,MATERIAL HANDLING,SHEET METAL,STRUCK BY",,,,,,346818131,1,783.0,,,,,1,Other
221579212,418800,6/29/2023,52,M,Employee is killed in fall from scissor lift,"Door,Electrical Work,Fall,Fall From Elevation,Fall Protection,Scissor lift,Struck Against,Tips Over",H,1.0,,,A,346817919,5,575.0,29.0,,20.0,20.0,1,Falls
221587132,552700,6/29/2023,59,M,Employee dies of heart attack,"Heart Attack,Working Alone",,,,,,346876121,14,999.0,,,,,1,Medical Events
221589294,111500,6/29/2023,36,M,Employee dies due to suspected drug overdose,"Drug Overdose,Unresponsive",,,,,,346805187,14,869.0,,,,,1,Other
221626179,953210,6/29/2023,64,M,Employee dies after being struck by sheet metal,"Blunt force,Blunt force trauma,Clamp,Equipment Failure,Falling Object,Fracture,Gantry Crane,Leg,Lifting,Overhead Crane,Sheet Metal,Shortness of breath,Struck By",,,,,,346818131,1,717.0,,,,,1,Falls
221576036,626700,6/28/2023,59,M,"Employee dies of heart attack, which may have been heat-related","Heart Attack,Heat,Heat Injury Prevention Program,Heat-related illness",,,,,,346798168,12,758.0,,,,,1,Medical Events
221576762,627100,6/28/2023,35,M,Employee is struck and killed by vehicle on busy highway,"Highway Shoulder,Motor Vehicle,Struck By,Tire",,,,,,346804198,1,505.0,,,,,1,Blunt Force/Struck By Objects
221577075,524200,6/28/2023,58,M,Employee is killed in fall from elevation,"Blunt force trauma,Fall,Fall From Elevation,Head,Hydraulic Fluid,Neck",,,,,,346806375,5,783.0,,,,,1,Falls
221577216,625500,6/28/2023,42,M,Employee is killed when crushed by granite slabs,"Crushed,Falling Object,Head,Torso,Truck Driver",,,,,,346807795,1,804.0,,,,,1,Falls
221577604,627700,6/28/2023,21,M,Employee is killed when shot by gunman,"Food service,Gun,Gunfire,Gunshot,Workplace Violence",,,,,,346805278,14,444.0,,,,,1,Violence
221581705,552652,6/28/2023,37,M,Employee is killed when struck by tree,"Chain Saw,Struck By,Tree,Tree Care,Tree Failure",,,,,,346839996,1,786.0,,,,,1,Blunt Force/Struck By Objects
221575590,454712,6/27/2023,34,M,Employee is killed in fall to ground,"Blunt force trauma,Fall,Fall From Elevation,Fall Protection,Head",,,,,,346795354,5,889.0,,,,,1,Falls
221575723,316100,6/27/2023,25,M,Employee is killed when trying to suppress fire,"Collapse,Fall,Fall From Elevation,Fire Fighter,Smoke,Smoke Inhalation,Trapped,structure fire",,,,,,346796659,5,,,,,,1,Falls
221575798,625500,6/27/2023,58,M,Employee dies of heart attack while doing crane work,"Cardiovasc Disease,Container,Crane,Natural Causes,Sling,Trailer",,,,,,346796881,12,849.0,,,,,1,Vehicle Accidents
221575954,418800,6/27/2023,58,M,Employee is killed when struck by vehicle,"Motor Vehicle,Struck By,Traffic Accident",G,,,,A,346797434,1,7010.0,45.0,,,,1,Blunt Force/Struck By Objects
221575962,552652,6/27/2023,61,M,Employee dies of natural causes,"Cardiovasc Disease,Landscaping,Natural Causes",,,,,,346797939,12,486.0,,,,,1,Medical Events
221575996,524700,6/27/2023,32,M,Employee dies via electrocution,"Bandsaw,Electric Shock,Electrocuted",,,,,,346798119,13,717.0,,,,,1,Electrocution/Shock
221576044,420600,6/27/2023,41,M,Employee dies of underlying medical condition,"Natural Causes,Seizure,Underlying Medical Condition",A,,10.0,,C,346798218,14,588.0,71.0,,,,1,Medical Events
221576291,626000,6/27/2023,59,M,Employee is found unresponsive and dies,Unresponsive,C,2.0,,,A,346800873,12,869.0,12.0,,,,1,Other
221576705,625700,6/27/2023,30,M,Employee dies of natural causes,"Cramp,Hand,Natural Causes,Pressure Wash",M,,0.0,,A,346803182,14,7010.0,35.0,,,,1,Medical Events
221589526,355111,6/27/2023,68,M,Employee is killed in fall from second story roof,"Fall,Fall From Elevation,Ladder,Roof,Unstable Position",A,,40.0,,C,346795594,5,579.0,12.0,,40.0,40.0,1,Falls
221594211,1055360,6/27/2023,63,M,Employee is killed when loader rolls over,"Bee Sting,Embankment,Loader,Medical Condition,Roll-Over",,,,,,346809320,14,999.0,,,,,1,Medical Events
221576085,855610,6/26/2023,56,M,Employee is killed when run over by motor vehicle,"Crushed,Motor Vehicle,Roll,Run Over",,,,,,346798358,1,614.0,,,,,1,Crushed/Caught Between
221576234,420600,6/26/2023,27,M,Employee dies of possible heat-related illness,"Gutter,Heat,Heat Injury Prevention Program,Heat-related illness,Unresponsive",A,1.0,,,C,346800162,14,,23.0,,,,1,Other
221577422,453730,6/26/2023,23,M,"One employee is killed, another employee is injured when struck by vehicle","Flagger,Flagman,Installing,Motor Vehicle,Pipe,Residential Construction,Struck By,Traffic Accident",,,,,,346799133,1,999.0,,,,,1,Blunt Force/Struck By Objects
221578271,830100,6/26/2023,34,M,Employee drowns while being caught on irrigation pipe,"Caught In,Drown,Drowning,Foot,Hand,Irrigation Pipe,Jammed,Stuck",,,,,,346814981,2,889.0,,,,,1,Other
221580582,636900,6/26/2023,46,M,Employee is killed when crushed between gate and trailer,"Caught Between,Crushed,Gate,Pinned,Trailer,Unloading",,,,,,346831985,2,804.0,,,,,1,Crushed/Caught Between
221588353,454510,6/26/2023,38,M,Employee dies from electrocution,"Construction,Contact,Electric Shock,Electrocuted,Energized,Installing,Metal,Residential Construction",,,,,,346807407,13,999.0,,,,,1,Electrocution/Shock
221575145,626300,6/24/2023,46,M,Employee is killed when struck by concrete block,"Concrete Block,Crushed,Struck By",C,2.0,,,A,346792021,1,869.0,28.0,,,,1,Blunt Force/Struck By Objects
221575582,626300,6/24/2023,67,M,Employee dies from medical issues aggravated by heat index,"Aggravated,Heat,Heat Exhaustion,Heat index,Heat-related illness,High Temperature,Humidity,Illness,Irrigation Equipment,Laborer,Medical Condition,Medical History,Natural Causes,Repair,Sprinkler,Underl",,,,,,346795289,14,869.0,,,,,1,Medical Events
221575640,953220,6/24/2023,20,M,Employee commits suicide,"Drug Overdose,Suicide,Unconsciousness",,,,,,346795552,14,734.0,,,,,1,Other
221583024,552651,6/24/2023,30,M,Employee drilling on equipment dies due to electrocution,"Construction,Contact,Drill,Drilling,Electric Shock,Electrical,Electrical Wire,Electrocuted,Glove,Hand,Installing,PPE,PPE Hazard Assessment,Repair,Shock",O,,20.0,,C,346851694,14,,70.0,,,,1,Electrocution/Shock
221574932,522000,6/23/2023,60,M,Employee is killed from head injury when grinding wheel explodes,"Defect,Defective,Defective Equipment,Flying Object,Foundry,Fracture,Grinding Machine,Grinding Wheel,Guard,Hand Tool,Head,Laceration,Lack of Engineering Controls,Machine Guarding,Safety Device,Skull,St",,,,,,346792039,1,644.0,,,,,1,Other
221575319,625500,6/23/2023,28,M,Employee dies by suicide jumping into active aircraft engine,"Aircraft,Airplane,Airport,Chock,Engine,Instantaneous amputation,Suicide,Torso,Traumatic Amputation,ingestion",,,,,,346793938,14,227.0,,,,,1,Other
