summary_nr,report_id,event_date,age,sex,event_desc,event_keyword,const_end_use,build_stories,nonbuild_ht,project_cost,project_type,rel_insp_nr,event_type,occ_code,const_op_cause,fat_cause,fall_distance,fall_ht,injury_line_nr,Category
221601628,627700,9/21/2023,21,M,Employee is killed in fall from height,"Blunt force trauma,Climbing on Ladder,Elevated Work Platform,Fall,Fall From Elevation,Ladder,Platform",,,,,,346991326,5,614.0,,,,,1,Falls
221601933,950625,9/21/2023,45,F,Employee dies after blow to head,"Agriculture,Agriculture Machinery/Vehicle,Backing Up,Blunt force trauma,Digger/Derrick,Head,Struck By,Unconsciousness",,,,,,346992068,1,889.0,,,,,1,Blunt Force/Struck By Objects
221601974,950614,9/21/2023,24,F,Employee is killed when shot,"Gun,Gunfire,Gunshot,Police,Unresponsive,Workplace Violence",,,,,,346992951,14,34.0,,,,,1,Violence
221602394,626300,9/21/2023,71,M,Employee dies of cardiovascular disease,"Cardiovasc Disease,Heart,Loading,Natural Causes,Package Delivery,Preexisting Condition,Trailer Truck,Underlying Medical Condition,Unresponsive",,,,,,346995574,14,799.0,,,,,1,Vehicle Accidents
221604937,950411,9/21/2023,35,M,Employee is killed in fall from roof,"Beam,Building,Compressor,Concrete Floor,Fall,Fall From Elevation,HVAC,Roof,Slip",B,,,,C,346991748,5,999.0,24.0,,32.0,,1,Falls
221647076,454510,9/21/2023,61,M,Employee is killed when crushed by skid steer that tips over,"Concrete,Construction,Construction vehicle,Crushed,Erection Process,Falling Object,Masonry,Material Handling,Misjudgment,Misjudgment of Hazardous Situation,Skid Steer loader,Steel Beam,Steel Erection,",,,,,,346997943,1,999.0,,,,,1,Falls
221601057,521700,9/20/2023,35,M,Employee is killed when struck by falling platform,"Abdomen,Blunt force trauma,Crushed,Fall,Fall From Elevation,Falling Object,Forks,Laborer,Load Shift,Struck By,Tree Trimming,Unsecured,Wheel Loader",,,,,,346987068,5,7010.0,,,,,1,Falls
221601248,627700,9/20/2023,30,M,Employee dies in confined space,"Asphyxiated,Confined Space,Oil Tank,Tank,Unconsciousness,Valve",,,,,,346989544,8,0.0,,,,,1,Asphyxiation
221601677,453710,9/20/2023,83,M,Employee is killed when caught between bucket and excavator,"Boom,Bucket,Caught Between,Crushed,Excavator,Extension Ladder,Fall,Fall From Elevation,Pinned,Repair,Wheel Loader",,,,,,346991441,2,999.0,,,,,1,Falls
221601917,950647,9/20/2023,43,M,Employee dies of cardiac arrest,"Agriculture,CPR,Cardiac Arrest,Cardiovasc System,Fall,Fall On Same Level,Harvester,Harvesting,Preexisting Condition,Tractor,Unconsciousness,Underlying Medical Condition,Unstable Position",,,,,,346991383,14,,,,,,1,Falls
221602410,950643,9/20/2023,59,F,Employee is killed when struck by commercial vehicle,"Backing Up,Driving,Struck Against,Struck By,Truck,Truck Driver",,,,,,346995640,1,889.0,,,,,1,Blunt Force/Struck By Objects
221603004,316100,9/20/2023,58,M,Employee with COVID-19 infection dies,Infectious Disease,,,,,,346998313,8,7.0,,,,,1,Other
221600687,552652,9/19/2023,59,M,Employee is killed while riding lawn mower,"Embankment,Fall,Fall From Elevation,Head,Hill,Lawn Mower,Pinned",,,,,,346984362,2,486.0,,,,,1,Falls
221601164,627100,9/19/2023,59,M,Employee is killed when struck by tree,"Blunt force trauma,Cutting,Flying Object,Head,Struck By,Tree,Tree Felling",,,,,,346987704,1,786.0,,,,,1,Blunt Force/Struck By Objects
221601198,215300,9/19/2023,21,M,Employee dies after electrocuted drilling holes in wet area,"Arm,Carpenter,Construction,Drilling,Electric Shock,Electrocuted,Elevated Work Plat,Elevated Work Platform,Fall,Ground Fault Circuit Interrupter (GFCI),Hand Tool,Insufficient Supervision,PPE,PPE Hazard",H,,,,A,346988124,13,869.0,70.0,,,,1,Falls
221601669,453730,9/19/2023,63,M,Employee is killed in fall from height,"Blunt force trauma,Fall,Fall From Elevation,Head",,,,,,346991482,5,999.0,,,,,1,Falls
221610322,950631,9/19/2023,80,F,Employee dies after door falls and crushes employee,"Blunt force trauma,Crushed,Door,Fall,Fall From Elevation,Falling Object,Head,Leg,Metal,Nursery,Stair,Struck Against,Struck By,Trailer",,,,,,347054637,1,337.0,,,,,1,Falls
221614100,155010,9/19/2023,57,M,Employee is killed when struck by plywood,"Crushed,Falling Object,Forks,Lung,Plywood,Powered Industrial Vehicle,Puncture,Puncture Wound,Spotting,Struck By,Unsecured,Unstable Load",C,1.0,,,A,347084360,2,7010.0,45.0,,,,1,Falls
221599889,551800,9/18/2023,59,M,Employee is killed due to blunt force trauma,"Blunt force trauma,Head,Interlock,Moving,Neck,Press",,,,,,346980063,2,706.0,,,,,1,Blunt Force/Struck By Objects
221600067,420600,9/18/2023,55,M,Employee is killed when crushed by falling pipe,"Crushed,Falling Object,Head,Loading,Metal Pipe",,,,,,346981343,1,889.0,,,,,1,Falls
221600224,854910,9/18/2023,41,M,Employee dies after electrocution while troubleshooting furnace,"Commercial Building,Construction,Electric Shock,Electrical Wire,Electrocuted,Furnace,HVAC,Installing,Misjudgment,Misjudgment of Hazardous Situation,PPE,PPE Hazard Assessment,Technician,Troubleshooting",C,2.0,,,A,346982226,13,534.0,24.0,,,,1,Electrocution/Shock
221600570,454714,9/18/2023,34,M,Employee is crushed and killed by mower,"Crushed,Head,Lawn Mower,Neck,Roll-Over,Slip",,,,,,346983620,1,579.0,,,,,1,Crushed/Caught Between
221600679,418800,9/18/2023,49,F,Lawn mower operator is killed when hit by car,"Caught Between,Lawn Mower,Motor Vehicle,Pinned,Road,Struck By,Tree",,,,,,346984263,1,777.0,,,,,1,Blunt Force/Struck By Objects
221601131,418600,9/18/2023,64,M,Employee is killed in fall while wiring light fixture,"Blunt force trauma,Electric Shock,Fall,Fall From Elevation,Head,Ladder,Lighting",,,,,,346987456,13,,,,,,1,Falls
221599939,950633,9/17/2023,41,M,Employee collapses and dies,"Natural Causes,Preexisting Condition,Underlying Medical Condition,Unresponsive",,,,,,346980287,14,,,,,,1,Medical Events
221600455,418200,9/17/2023,40,M,"Employee cutting rebar sustains head injury, later dies","Collapse,Concrete Floor,Concrete Slab,Construction,Fall,Fall From Elevation,Fall Protection,Hammer,Head,Laborer,Lanyard,Rebar,Saw",C,2.0,,,D,346983547,5,869.0,5.0,,17.0,17.0,1,Falls
221600026,317500,9/16/2023,59,M,Employee is killed when truck rolls backwards,"Asphalt,Backing Up,Caught Between,Crushed,Dump Truck,Pinned,Trailer,Trapped,Truck",I,,,,A,346981210,1,804.0,34.0,,,,1,Crushed/Caught Between
221600042,418800,9/16/2023,33,M,Employee is electrocuted and killed,"Air Conditioner,Clearing,Electrocuted,Energized,Landscaping",,,,,,346981277,13,0.0,,,,,1,Electrocution/Shock
221600265,950624,9/16/2023,63,M,Employee dies of heart attack,"Bus,Heart Attack,Natural Causes,Preexisting Condition,Underlying Medical Condition,Unresponsive",,,,,,346982283,14,,,,,,1,Medical Events
221600901,418800,9/16/2023,26,M,Employee dies of heat-related illness,"Agriculture,Heat,Heat Injury Prevention Program,Heat-related illness,Unconsciousness",,,,,,346986094,14,474.0,,,,,1,Other
221613250,1054115,9/16/2023,62,M,Employee is killed in motor vehicle accident fire,"Engulfed,Fire,Motor Vehicle,Struck Against,Traffic Accident,Trailer,Tree",,,,,,347078453,6,999.0,,,,,1,Blunt Force/Struck By Objects
221599558,111100,9/15/2023,48,M,Employee repairing asphalt is killed when run over by truck,"Amputated,Amputation,Asphalt,Cleaning,Construction,Construction vehicle,Crushed,Equipment Operator,Fracture,Highway,Instantaneous amputation,Leg,Motor Vehicle,Repair,Road,Road Paving,Run Over,Traumati",I,,,,C,346978943,1,7035.0,34.0,,,,1,Crushed/Caught Between
221599830,418100,9/15/2023,22,M,Employee is killed in fall from ladder,"Blunt force trauma,Concrete Floor,Extension Ladder,Fall,Fall From Elevation,Head,Ladder,Roof",,,,,,346979941,5,,,,,,1,Falls
221599905,626700,9/15/2023,18,M,Employee is killed when crushed and asphyxiated in trench collapse,"Asphyxiated,Caught Between,Collapse,Concrete Pipe,Crushed,Crushing,Engulfed,Excavation,Inexperience,Laborer,Lack of Engineering Controls,Lack of oxygen,Trench,Unstable Soil,Water Pipe",A,,15.0,,A,346978901,2,869.0,11.0,,,,1,Crushed/Caught Between
221600075,751910,9/15/2023,41,M,Employee is killed when crushed by electric pallet stacker,"Carpenter,Concrete Floor,Crushed,Falling Object,Head,Lack of Engineering Controls,Lack of Work Procedures,Load Shift,Material Handling,Misjudgment,Misjudgment of Hazardous Situation,Overhead Door,Pall",,,,,,346981426,1,567.0,,,,,1,Falls
221600083,523900,9/15/2023,32,M,Employee is killed in fall off extension ladder,"Antenna,Blunt force trauma,Chest,Extension Ladder,Fall,Fall From Elevation,Finger,Ladder,Pinched,Roof,Technician",,,,,,346981434,5,7054.0,,,,,1,Falls
221602949,728900,9/15/2023,37,M,Employee is killed in fall off ladder,"Blunt force trauma,Concrete,Concrete Floor,Fall,Fall From Elevation,Head,Ladder,Reaching,Reaching From Ladder,Siding",H,,15.0,,A,346997810,5,595.0,43.0,,15.0,15.0,1,Falls
221607682,950644,9/15/2023,46,M,Employee is killed in fall from height,"Concrete Floor,Fall,Fall From Elevation,Order-picker,Picking an order,Storage Rack",,,,,,347034183,5,0.0,,,,,1,Falls
221644487,552651,9/15/2023,41,M,Employee is killed when struck by iron end cap,"Blunt force trauma,Falling Object,Head,High Pressure,Iron,Struck By",D,2.0,,,A,346979255,1,,29.0,,,,1,Falls
221599251,950625,9/14/2023,60,M,Employee dies of heart condition,"Heart,Heart Attack,Natural Causes,Preexisting Condition,Steel Beam,Underlying Medical Condition",,,,,,346977176,14,644.0,,,,,1,Medical Events
221599459,950644,9/14/2023,52,M,Employee dies from unknown cause,"CPR,Parking Lot,Unconsciousness,Unresponsive,Vehicle",,,,,,346978356,14,,,,,,1,Other
221599749,950632,9/14/2023,57,M,Employee dies from head trauma in fall when scaffold collaps,"Carpenter,Collapse,Competent Person,Construction,Fall,Fall From Elevation,Fall Protection,Injury Illness Prevention Program,Laborer,Renovation,Scaffold,Scaffold Collapse,Structural Collapse",,,,,,346979669,14,869.0,,,,,1,Falls
221600141,112000,9/14/2023,20,M,Employee is killed when struck by motor vehicle,"Motor Vehicle,Road,Roll-Over,Struck By,Tractor,Traffic Accident",,,,,,346981731,1,889.0,,,,,1,Blunt Force/Struck By Objects
221603038,355111,9/14/2023,32,M,Employee is killed when struck by falling tree trunk,"Asphyxiated,Broken Bone,Chain Saw,Crushed,Falling Object,Rolled,Struck By,Tree Care,Tree Felling,Tree Limb",,,,,,346981228,1,579.0,,,,,1,Falls
221645369,419400,9/14/2023,28,F,Employee is killed when exposed to carbon dioxide,Carbon Dioxide,,,,,,347309650,8,,,,,,1,Other
221599012,523400,9/13/2023,34,M,Employee dies when struck by water main cap projectile,"Blunt force,Blunt force trauma,Bolt,Construction,Flying Object,Head,High Blood Pressure,High Pressure,High Pressure Pipe,Installing,Metal Pipe,Pipe,Plumbing,Removing,Struck By,Torso,Water Pipe",P,,,,A,346975253,1,557.0,52.0,,,,1,Blunt Force/Struck By Objects
221599178,213600,9/13/2023,23,M,Employee is killed when struck by motor vehicle,"Bucket,Filling,Flatbed Truck,Motor Vehicle,Road,Struck By,Traffic Accident",,,,,,346976988,1,,,,,,1,Blunt Force/Struck By Objects
221599483,552700,9/13/2023,44,M,Employee dies from natural causes after fall from roof,"Cardiovasc Disease,Cardiovasc System,Construction,Fall,Fall From Elevation,Fall Protection,Heart,Multi-employer Worksite,Multiemployer,Natural Causes,Respiratory Tract,Roof,Roofer,Slip",,,,,,346978539,12,999.0,,,,,1,Falls
221599525,830400,9/13/2023,58,M,Employee is killed in fall from roof while replacing steel panels,"Blunt force,Blunt force trauma,Building,Carpenter,Commercial Building,Construction,Fall,Fall From Elevation,Fall Protection,Harness,Installing,Lack of Engineering Controls,Lack of Work Procedures,Misj",C,2.0,,,C,346978828,5,567.0,43.0,,25.0,30.0,1,Falls
221600349,1055340,9/13/2023,31,F,Employee drowns in river,"Current,Drown,Drowning,River,Swim,Water",,,,,,346980782,2,999.0,,,,,1,Other
221600562,627100,9/13/2023,75,F,Employee dies from brain bleed,"Brain Bleed,Broken Bone,Floor,Fracture,Neck,Struck Against,Tripped,Wrist",,,,,,346983760,4,139.0,,,,,1,Blunt Force/Struck By Objects
221640659,215000,9/13/2023,64,M,Employee is killed in fall from height,"Asbestos,Asbestos Removal,Fall,Fall From Elevation,Floor Hole,Plank,Plastic,Roof,Unsecured,Walking On Plank",C,12.0,,,D,346977754,5,7010.0,5.0,,12.0,0.0,1,Falls
221645294,418800,9/13/2023,75,M,Employee is killed in fall from ladder,"Ascending,Building,Climbing on Ladder,Contusion,Descending Ladder,Face,Fall,Fall From Elevation,Fracture,Ladder,Lost Balance,Nose,Paint,Painter,Scaffold,Skull",C,1.0,,,C,347310922,5,759.0,15.0,,,,1,Falls
221598634,950635,9/12/2023,51,M,Employee is killed in fall from height,"Coating Operation,Drug Overdose,Fall,Fall From Elevation,Forehead,Laceration",,,,,,346972243,14,,,,,,1,Falls
221598675,454510,9/12/2023,34,M,Employee is killed when electrocuted,"Boom,Conduit,Derrick Truck,Digger/Derrick,Electrocuted,Installing,Overhead Power Line,Pipe,Trench,Trench Digger,Wire Line",,,,,,346972730,13,999.0,,,,,1,Vehicle Accidents
221599186,830100,9/12/2023,56,M,Employee is killed when crushed by 30-inch step feeder,"Crushed,Hydraulic,Hydraulic Equipment",,,,,,346977002,2,549.0,,,,,1,Crushed/Caught Between
221599376,418200,9/12/2023,48,M,Employee dies talking on phone after being found unresponsive,"Cardiac Arrest,Cardiovasc Disease,Cardiovasc System,Construction,Construction vehicle,Electrical Work,Heart,Heart Attack,Medical Condition,Medical History,Motor Vehicle,Underlying Medical Condition,Un",C,1.0,,,A,346977945,12,,29.0,,,,1,Vehicle Accidents
221600166,257240,9/12/2023,60,F,Employee is killed after collapse,"Fainted,Unresponsive",,,,,,346981780,14,779.0,,,,,1,Other
221600356,420600,9/12/2023,36,M,"Employee sustains concussion when struck by beam, later dies","Blunt force,Blunt force trauma,Concussion,Construction,Electrician,Falling Object,Hard Hat,Head,Installing,Metal,Multi-employer Worksite,Multiemployer,PPE,PPE Hazard Assessment,Steel Beam,Struck By,Un",,,,,,346983109,1,575.0,,,,,1,Falls
221597867,317500,9/11/2023,27,M,Employee stretching out rope is killed in fall to ground,"Blunt force trauma,Fall,Fall From Elevation,Fall On Same Level,Rope",C,4.0,,,C,346967649,5,595.0,43.0,,40.0,40.0,1,Falls
221597909,454711,9/11/2023,64,M,Employee is killed in fall from balcony,"Balcony,Contusion,Drywall,Fall,Fall From Elevation,Head,Sanding Machine",A,2.0,,,A,346968019,5,869.0,20.0,,12.0,12.0,1,Falls
221597917,953220,9/11/2023,43,M,Employee is killed when electrocuted,"Electrocuted,Lighting,Overhead Power Line",B,,,,A,346968035,14,,25.0,,,,1,Electrocution/Shock
221598295,521700,9/11/2023,25,M,Employee is killed when crushed by bundle of quartz slabs,"Bundle,Container,Crushed,Falling Object,Forklift,Forks,Lifting,Mast,Material Handling,Stuck,Unloading",,,,,,346970635,14,883.0,,,,,1,Falls
221598352,627700,9/11/2023,69,M,Employee is killed in fall from ladder,"Blunt force trauma,Extension Ladder,Fall,Fall From Elevation,Fracture,Head,Installing,Ladder,Neck,Skull",,,,,,346970775,5,7055.0,,,,,1,Falls
221598824,751910,9/11/2023,57,M,Employee is killed when struck by lumber,"Backing Up,Crushed,Falling Object,Forklift,Lumber,Pinned,Struck By",,,,,,346973894,1,658.0,,,,,1,Falls
221599319,355121,9/11/2023,41,M,Employee dies from heart attack while operating PIV,"Cardiac Arrest,Cardiovasc Disease,Cardiovasc System,Chest,Forklift,Heart,Heart Attack,Industrial Truck,Material Handling,Medical Condition,Medical History,PIV,Powered Industrial Vehicle,Respiratory Tr",,,,,,346977499,12,727.0,,,,,1,Vehicle Accidents
221600323,1055330,9/11/2023,41,M,Employee dies from head injuries in fall from scissor lift,"Blunt force,Blunt force trauma,Construction,Fall,Fall From Elevation,Fall Protection,Falling Object,Framing,H-Beam,Head,Residential Construction,Scissor lift,Steel Beam,Struck Against,Training,Wood,Wo",,,,,,346980725,1,999.0,,,,,1,Falls
221600331,1055350,9/11/2023,68,M,Employee is killed when airbag explodes,"Explosion,Mechanic,Trailer",,,,,,346975923,1,999.0,,,,,1,Vehicle Accidents
221601941,352470,9/11/2023,67,M,Employee is crushed and killed by falling load from flatbed,"Backing Up,Blocks,Chock,Crushed,Falling Object,Flatbed Truck,Load Shift,Overhead Crane,Parking Lot,Pinch Point,Steel,Storage Rack,Struck By,Unsecured,Wood",,,,,,346967714,1,7013.0,,,,,1,Falls
221597560,336000,9/10/2023,60,M,Employee is killed from head injury,"Concrete Floor,Head,Pallet,Removing,Storage Rack,Unconsciousness",,,,,,346965544,14,,,,,,1,Construction/Material Handling
221598501,950644,9/10/2023,59,M,Employee dies of atherosclerotic heart disease,"Cardiovasc Disease,Cardiovasc System,Heart,Natural Causes,Parking Lot,Preexisting Condition,Tractor,Trailer,Truck Driver,Underlying Medical Condition",,,,,,346971757,12,7056.0,,,,,1,Vehicle Accidents
221600273,418800,9/10/2023,30,M,Employee is killed when electrocuted while performing power line operation,"Back,Clothing,Construction,Contact,Cutout Switch,Electric Shock,Electrical Burn,Electrical Wire,Electrical Work,Electrocuted,High Voltage,Leg,Material Handling,Neck,Overhead Power Line,PPE,PPE Hazard",O,,,,B,346964067,13,7015.0,70.0,,,,1,Electrocution/Shock
221613276,1055350,9/10/2023,23,M,Two employees are killed when hit by truck on highway,"Blunt force trauma,Highway,Motor Vehicle,Road,Struck By,Traffic Accident,Tree Care,Truck",,,,,,347074858,1,999.0,,,,,1,Blunt Force/Struck By Objects
221613276,1055350,9/10/2023,27,M,Two employees are killed when hit by truck on highway,"Blunt force trauma,Highway,Motor Vehicle,Road,Struck By,Traffic Accident,Tree Care,Truck",,,,,,347074858,1,999.0,,,,,2,Blunt Force/Struck By Objects
221597446,625700,9/9/2023,36,M,Employee is killed when struck by motor vehicle,"Construction,Highway,Highway Shoulder,Highway work zone,Motor Vehicle,Struck By,Traffic Accident",I,,0.0,,C,346964810,1,,70.0,,,,1,Blunt Force/Struck By Objects
221597859,551800,9/9/2023,33,M,Employee is killed when stabbed by coworker,"Dishwasher,Gas Station,Knife,Restaurant,Stabbed,Workplace Violence",,,,,,346967581,14,889.0,,,,,1,Violence
221598329,728500,9/9/2023,53,M,Employee is killed in fall from roof,"Blunt force trauma,Fall,Fall From Elevation,Head,Roof,Roof Opening",H,1.0,,,E,346970718,5,595.0,43.0,,,,1,Falls
221601552,257220,9/9/2023,53,M,Employee is killed of cardiac episode,"Cardiac Arrest,Dizziness,Heart,High Blood Pressure",,,,,,346977515,12,888.0,,,,,1,Medical Events
221597453,625700,9/8/2023,29,M,Employee is killed when electrocuted,"Cable,Derrick,Derrick Truck,Electrocuted,Overhead Power Line",,,,,,346964950,14,889.0,,,,,1,Vehicle Accidents
221597701,627500,9/8/2023,55,M,"Employee is killed when lacerates head, abdomen and arm","Abdomen,Arm,Blade,Disc,Head,Laceration,Mixer Blade",,,,,,346966534,14,889.0,,,,,1,Other
221597818,111700,9/8/2023,73,M,Employee is killed in fall off pickup truck,"Blunt force trauma,Broken,Face,Fall,Fall From Elevation,Head,Laceration,Truck",,,,,,346967557,5,,,,,,1,Falls
221597842,626600,9/8/2023,42,M,Employee is killed when electrocuted,"Blunt force trauma,Climbing on Ladder,Electrocuted,Fall,Fall From Elevation,Head,Installing,Ladder,Lighting,Struck Against",H,1.0,,,A,346967631,5,,25.0,,4.0,4.0,1,Falls
221598543,950633,9/8/2023,56,M,Employee dies of heart attack,"Arm,Back,CPR,Collapse,Heart Attack,Natural Causes,Preexisting Condition",,,,,,346971880,14,,,,,,1,Crushed/Caught Between
221599160,418400,9/8/2023,60,M,Employee is killed when struck by sweeper,"Broken Bone,Crushed,Crushing,Inspecting,Milling Machine,Road Paving,Struck By,Sweeper",I,,,,C,346976947,1,,34.0,,,,1,Blunt Force/Struck By Objects
221604358,316700,9/8/2023,57,M,Employee is killed when crushed by machine,"Abdomen,Bucket,Casting,Cleaning,Crushed,Pinched,Reaching",,,,,,347008518,2,779.0,,,,,1,Crushed/Caught Between
221597271,626300,9/7/2023,59,M,Employee is killed in fall from height,"Fall,Fall From Elevation,Jammed,Silo",,,,,,346963663,5,,,,,,1,Falls
221597982,751910,9/7/2023,57,M,Employee dies after fall from box truck,"Blunt force trauma,Box truck,Concrete Floor,Crate,Fall,Fall From Elevation,Unloading,Warehouse",,,,,,346967961,5,843.0,,,,,1,Falls
221598832,524530,9/7/2023,23,M,Employee dies from head trauma in fall while setting trusses,"Blunt force,Blunt force trauma,Commercial Building,Concrete Floor,Concrete Surface,Construction,Construction vehicle,Contusion,Crane Load,Fall,Fall From Elevation,Fall Protection,Head,Installing,Insuf",H,1.0,,,A,346963614,5,567.0,14.0,,22.0,22.0,1,Falls
221599442,950643,9/7/2023,22,M,Employee dies of blunt force trauma to the chest,"Agriculture Machinery/Vehicle,Backing Up,Blunt force trauma,Chest,Driver,Struck By,Tractor--Truck,Trailer",,,,,,346978331,14,0.0,,,,,1,Blunt Force/Struck By Objects
221599517,419700,9/7/2023,55,M,Employee dies of possible heart attack,"CPR,Edger,Heart Attack,Natural Causes,Preexisting Condition,Seizure,Truck,Underlying Medical Condition,Unresponsive",,,,,,346965056,12,486.0,,,,,1,Vehicle Accidents
221601008,625400,9/7/2023,46,M,Employee dies of heat-related illness,"Cardiac Arrest,Delivery Work,Heat,Heat Exhaustion,Heat Injury Prevention Program,Heat Stroke,Heat index,Heat-related illness,Package Delivery",,,,,,346986920,14,805.0,,,,,1,Medical Events
221601073,551800,9/7/2023,54,M,Employee dies after two heart attacks,"Cardiac Arrest,Heart Attack,Natural Causes,Powered Industrial Vehicle,Preexisting Condition,Underlying Medical Condition",,,,,,346987225,14,856.0,,,,,1,Medical Events
221602568,830100,9/7/2023,71,M,Employee is killed in fall from ladder,"Concrete Floor,Fall,Fall From Elevation,Grain,Ladder,Pushing,Tractor Trailer",,,,,,346996572,14,,,,,,1,Falls
221609407,950643,9/7/2023,32,F,Employee is killed when struck on head by airplane propeller,"Aircraft Propeller,Airplane,Blunt force trauma,Head,Struck By,Testing",,,,,,347048910,1,508.0,,,,,1,Blunt Force/Struck By Objects
221596711,111400,9/6/2023,25,M,Employee is crushed and killed by conveyor,"Conveyor,Crushed,Head,Machine operator",,,,,,346959349,1,869.0,,,,,1,Crushed/Caught Between
221596976,950625,9/6/2023,23,M,Employee is killed via electrocution,"Connector,Contact,Electrocuted,Panel,Solar",,,,,,346960875,13,,,,,,1,Electrocution/Shock
221597040,454712,9/6/2023,64,F,Employee falls down stairs and dies from blunt force trauma,"Blunt force trauma,Fall,Fall From Elevation,Head,Hospital,Natural Causes,Stair,Underlying Medical Condition",,,,,,346961162,5,5.0,,,,,1,Falls
221597081,522500,9/6/2023,46,M,Employee is electrocuted after contacting overhead powerline,"Conductive Hose,Contact,Electrocuted,Installing,Optical Fiber Cable,Overhead Power Line,Roller--Const Equip",O,,,,A,346961857,13,7055.0,,,,,1,Electrocution/Shock
221597131,454715,9/6/2023,57,M,Employee is killed when struck by/crushed by wood pack,"Crushed,Falling Object,Hemorrhage,Liver,Roller Conveyor,Shock,Struck By",,,,,,346962392,1,,,,,,1,Falls
221601693,1054115,9/6/2023,63,M,Employee is killed when run over by forklift,"Forklift,Run Over,Struck By",,,,,,346991623,1,889.0,,,,,1,Blunt Force/Struck By Objects
221602089,1055320,9/6/2023,54,M,Employee dies from trauma in vehicle crash after tire blowout,"Blowout--Tire,Blunt force,Blunt force trauma,Construction,Driving,Highway,Motor Vehicle,Road,Tire,Traffic Accident",,,,,,346967375,14,999.0,,,,,1,Blunt Force/Struck By Objects
221604374,352440,9/6/2023,55,M,Employee is killed when struck by motor vehicle,"Caught Between,Crushed,Garbage Truck,Motor Vehicle,Pinned,Road,Struck By,Traffic Accident",,,,,,346962004,1,,,,,,1,Blunt Force/Struck By Objects
221605579,150900,9/6/2023,34,M,One employee is killed by blunt injuries in patrol vehicle crash,"Ankle,Blunt force trauma,Collision,Ejected,Fracture,Head,Motor Vehicle,Neck,Police,Rupture,Spleen,Torso,Traffic Accident,Vertebra",,,,,,346971047,1,7030.0,,,,,1,Blunt Force/Struck By Objects
221646094,625400,9/6/2023,39,M,Employee is killed in fall through roof hole to tile floor,"Blunt force,Blunt force trauma,Commercial Building,Concrete Floor,Construction,Fall,Fall From Elevation,Fall Protection,Head,Insufficient Supervision,Lack of Work Procedures,Misjudgment,Misjudgment of",C,2.0,,,B,346966419,5,595.0,43.0,,20.0,,1,Falls
221596943,950621,9/5/2023,22,M,Employee drowns when equipment rolls over,"Agriculture Machinery/Vehicle,Driver,Drown,Drowning,Roll-Over",,,,,,346960503,2,479.0,,,,,1,Other
221597057,453710,9/5/2023,29,F,Employee dies while harvesting potatoes,"Heat,Heat Injury Prevention Program,Heat-related illness,Natural Causes,Preexisting Condition,Underlying Medical Condition",,,,,,346961196,12,999.0,,,,,1,Medical Events
221597289,253640,9/5/2023,24,M,Employee dies of cardiac arrest,"Cardiac Arrest,Garbage Truck,Heart Attack,Natural Causes,Preexisting Condition,Underlying Medical Condition",,,,,,346963473,14,,,,,,1,Vehicle Accidents
221598303,317500,9/5/2023,47,M,Employee is killed when caught in running rollers,"Caught In,Dragged,Lockout/Tagout,Machine Guarding,Roller--Mach/Part,Rotating Parts",,,,,,346958747,6,843.0,,,,,1,Other
221601370,355123,9/5/2023,62,M,Employee dies of unknown causes while operating heavy equipment,"Cardiac Arrest,Cardiovasc Disease,Cardiovasc System,Construction,Construction vehicle,Driving,Heart,Mechanic,Medical Condition,Medical History,Motor Vehicle,Underlying Medical Condition,Unresponsive",M,,,,A,346959422,12,516.0,71.0,,,,1,Vehicle Accidents
221615057,453720,9/5/2023,38,M,Employee dies after struck by motor vehicle,"Motor Vehicle,Road,Struck By,Traffic Accident,Traffic Control",,,,,,346995947,1,999.0,,,,,1,Blunt Force/Struck By Objects
221644370,316700,9/5/2023,62,M,Employee is killed when crushed by boulder,"Boulder,Caught Between,Crushed,Dump Truck Bed,Excavator,Falling Object,Pinned",,,,,,346958093,2,486.0,,,,,1,Falls
221624877,936100,9/4/2023,25,M,Employee is killed when struck by falling tree,"Falling Object,Jack,Struck By,Tree,Tree Felling",,,,,,346964232,1,496.0,,,,,1,Falls
221647555,453710,9/4/2023,43,M,Employee is killed when pinned between vehicle and aircraft,"Accelerator Pedal,Airplane,Airport,Backing Up,Brake,Caught Between,Crushed,Pinned,Ramp,Slip,Truck",,,,,,347052326,2,999.0,,,,,1,Crushed/Caught Between
